{
  "subsidy_id": "fixture-journey-post-submit",
  "schema_version": "2.0",
  "spec_version": 1,
  "name": "Journey map post-submit procedure fixture",
  "round": "fixture",
  "portal_url": null,
  "category_tags": [
    "sales_marketing"
  ],
  "status": "confirmed",
  "registry": null,
  "source_documents": [
    {
      "document_id": "doc-1",
      "title": "Fixture source",
      "url_or_path": "fixture-source.pdf",
      "sha256": null,
      "pages": 1
    }
  ],
  "schedule": [
    {
      "event_id": "draft-interim",
      "name": "計画書中間締切",
      "event_kind": "other",
      "date": "2026-11-20",
      "starts_at": null,
      "ends_at": null,
      "relative": null,
      "time": "17:00",
      "timezone": "Asia/Tokyo",
      "hard": true,
      "phase": "application",
      "source_clauses": [
        "clause-1"
      ]
    },
    {
      "event_id": "submit-interim",
      "name": "添付手続き中間締切",
      "event_kind": "other",
      "date": "2026-12-10",
      "starts_at": null,
      "ends_at": null,
      "relative": null,
      "time": "18:00",
      "timezone": "Asia/Tokyo",
      "hard": true,
      "phase": "application",
      "source_clauses": [
        "clause-1"
      ]
    },
    {
      "event_id": "application-deadline",
      "name": "申請締切",
      "event_kind": "application_deadline",
      "date": "2026-12-31",
      "starts_at": null,
      "ends_at": null,
      "relative": null,
      "time": null,
      "timezone": "Asia/Tokyo",
      "hard": true,
      "phase": "application",
      "source_clauses": [
        "clause-1"
      ]
    },
    {
      "event_id": "oral-exam-window",
      "name": "口頭審査 実施期間",
      "event_kind": "other",
      "date": "2027-01-20",
      "starts_at": null,
      "ends_at": null,
      "relative": null,
      "time": null,
      "timezone": "Asia/Tokyo",
      "hard": true,
      "phase": "application",
      "source_clauses": [
        "clause-1"
      ]
    },
    {
      "event_id": "extra-docs-window",
      "name": "追加資料 提出期限",
      "event_kind": "other",
      "date": "2027-01-20",
      "starts_at": null,
      "ends_at": null,
      "relative": null,
      "time": null,
      "timezone": "Asia/Tokyo",
      "hard": true,
      "phase": "application",
      "source_clauses": [
        "clause-1"
      ]
    }
  ],
  "eligibility": {
    "rules": [
      {
        "rule_id": "rule-1",
        "kind": "mandatory",
        "predicate_polarity": "direct",
        "text": "Fixture mandatory rule.",
        "predicate": null,
        "verification": "Fixture verification.",
        "source_clauses": [
          "clause-1"
        ]
      }
    ]
  },
  "funding": {
    "base_award": {
      "name": "Base award",
      "max_amount": 50,
      "subsidy_rate": 0.6667,
      "source_clauses": [
        "clause-1"
      ]
    },
    "add_ons": [],
    "combinations": [],
    "eligible_expenses": [
      {
        "category": "広報費",
        "notes": null,
        "cap_amount": null,
        "source_clauses": [
          "clause-1"
        ]
      }
    ]
  },
  "bonus_items": [],
  "deliverables": [
    {
      "deliverable_id": "draft-plan",
      "name": "事業計画書",
      "type": "document",
      "phase": "application",
      "produced_by": "ai_draftable",
      "issuer": null,
      "required": true,
      "required_if": null,
      "format": null,
      "upload_target": null,
      "due_event_id": "draft-interim",
      "sections": [
        {
          "section_id": "overview",
          "name": "事業概要",
          "kind": "prose",
          "max_chars": 400,
          "max_pages": null,
          "guidance": "Fixture guidance.",
          "review_criteria": [
            "Fixture criterion."
          ],
          "source_clauses": [
            "clause-1"
          ]
        }
      ],
      "evidence_needed": null,
      "depends_on": [],
      "source_clauses": [
        "clause-1"
      ]
    },
    {
      "deliverable_id": "account-prep",
      "name": "電子申請アカウントの取得",
      "type": "procedure",
      "phase": "application",
      "produced_by": "human_only",
      "issuer": null,
      "required": true,
      "required_if": null,
      "format": null,
      "upload_target": null,
      "due_event_id": "application-deadline",
      "sections": [],
      "evidence_needed": null,
      "depends_on": [],
      "source_clauses": [
        "clause-1"
      ]
    },
    {
      "deliverable_id": "portal-procedure",
      "name": "添付書類アップロード",
      "type": "procedure",
      "phase": "application",
      "produced_by": "human_only",
      "issuer": null,
      "required": true,
      "required_if": null,
      "format": null,
      "upload_target": "電子申請システム",
      "due_event_id": "submit-interim",
      "sections": [],
      "evidence_needed": null,
      "depends_on": [
        "draft-plan",
        "account-prep"
      ],
      "source_clauses": [
        "clause-1"
      ]
    },
    {
      "deliverable_id": "extra-docs",
      "name": "追加資料の提出",
      "type": "procedure",
      "phase": "application",
      "produced_by": "human_only",
      "issuer": null,
      "required": true,
      "required_if": null,
      "format": null,
      "upload_target": null,
      "due_event_id": "extra-docs-window",
      "sections": [],
      "evidence_needed": null,
      "depends_on": [
        "oral-exam"
      ],
      "source_clauses": [
        "clause-1"
      ]
    },
    {
      "deliverable_id": "oral-exam",
      "name": "口頭審査",
      "type": "procedure",
      "phase": "application",
      "produced_by": "human_only",
      "issuer": null,
      "required": true,
      "required_if": null,
      "format": null,
      "upload_target": null,
      "due_event_id": "oral-exam-window",
      "sections": [],
      "evidence_needed": null,
      "depends_on": [
        "portal-procedure"
      ],
      "source_clauses": [
        "clause-1"
      ]
    }
  ],
  "clauses": [
    {
      "clause_id": "clause-1",
      "section": "fixture",
      "text": "Fixture clause text.",
      "raw_text": "Fixture clause text.",
      "source_document_id": "doc-1",
      "page": 1,
      "source_offset": null,
      "topic_tags": []
    }
  ],
  "parsed_at": "2026-07-25",
  "parsed_by": "human"
}
